{
  "schema_version": "schema_v1",
  "instance_id": "arrays_binary_search_004",
  "benchmark_version": "v0.3",
  "obligations": [
    {
      "id": "obl_001",
      "kind": "postcondition",
      "lean_statement": "\u2200 (arr : Arr) (t : Int) (i : Nat), binarySearch arr t = some i \u2192 i < arr.length \u2227 arr.get? i = some t",
      "nl_gloss": "If the function returns Some i, then i is in range and arr[i] equals the target.",
      "linked_semantic_units": [
        "SU2"
      ],
      "importance": "critical",
      "proof_relevance": "direct"
    },
    {
      "id": "obl_002",
      "kind": "postcondition",
      "lean_statement": "\u2200 (arr : Arr) (t : Int), SortedLE arr \u2192 binarySearch arr t = none \u2192 \u2200 i, i < arr.length \u2192 arr.get? i \u2260 some t",
      "nl_gloss": "Assuming the input is sorted in nondecreasing order, if the function returns None then the target does not occur anywhere in the slice.",
      "linked_semantic_units": [
        "SU1",
        "SU3"
      ],
      "importance": "critical",
      "proof_relevance": "direct"
    }
  ]
}
