{
  "schema_version": "schema_v1",
  "instance_id": "arrays_binary_search_002",
  "benchmark_version": "v0.2",
  "obligations": [
    {
      "id": "obl_001",
      "kind": "postcondition",
      "lean_statement": "∀ (arr : Arr) (t : Int) (i : Nat), binarySearch arr t = some i → i < arr.length ∧ arr.get? i = some t",
      "nl_gloss": "If the function returns Some i, then i is in range and arr[i] equals the target.",
      "linked_semantic_units": ["SU2"],
      "importance": "critical",
      "proof_relevance": "direct"
    },
    {
      "id": "obl_002",
      "kind": "postcondition",
      "lean_statement": "∀ (arr : Arr) (t : Int), SortedLE arr → binarySearch arr t = none → ∀ i, i < arr.length → arr.get? i ≠ some t",
      "nl_gloss": "Assuming the input is sorted in nondecreasing order, if the function returns None then the target does not occur anywhere in the slice.",
      "linked_semantic_units": ["SU1", "SU3"],
      "importance": "critical",
      "proof_relevance": "direct"
    }
  ]
}
