{
  "schema_version": "schema_v1",
  "instance_id": "greedy_coin_change_canonical_001",
  "benchmark_version": "v0.1",
  "obligations": [
    {
      "id": "obl_001",
      "kind": "postcondition",
      "lean_statement": "∀ (denoms : Denoms) (amt : Nat), (coinChangeCanonical denoms amt).length = denoms.length",
      "nl_gloss": "The returned counts vector aligns with the denomination vector.",
      "linked_semantic_units": ["SU2"],
      "importance": "supporting",
      "proof_relevance": "auxiliary"
    },
    {
      "id": "obl_002",
      "kind": "postcondition",
      "lean_statement": "∀ (denoms : Denoms) (amt : Nat), Decomposes denoms (coinChangeCanonical denoms amt) amt",
      "nl_gloss": "The returned counts decompose the target amount.",
      "linked_semantic_units": ["SU3"],
      "importance": "critical",
      "proof_relevance": "direct"
    },
    {
      "id": "obl_003",
      "kind": "postcondition",
      "lean_statement": "∀ (denoms : Denoms) (amt : Nat) (alt : Counts), Canonical denoms → Decomposes denoms alt amt → (coinChangeCanonical denoms amt).sum ≤ alt.sum",
      "nl_gloss": "When the denomination system is canonical, the greedy count sum is at most any competing valid decomposition's sum.",
      "linked_semantic_units": ["SU1", "SU4"],
      "importance": "critical",
      "proof_relevance": "direct"
    }
  ]
}
