{
  "schema_version": "schema_v1",
  "instance_id": "trees_bst_insert_002",
  "benchmark_version": "v0.2",
  "obligations": [
    {
      "id": "obl_001",
      "kind": "postcondition",
      "lean_statement": "∀ (t : Tree) (k : Int), IsBst t → IsBst (bstInsert t k)",
      "nl_gloss": "If the input tree is a valid BST, the output tree preserves the BST invariant.",
      "linked_semantic_units": ["SU1", "SU2"],
      "importance": "critical",
      "proof_relevance": "direct"
    },
    {
      "id": "obl_002",
      "kind": "postcondition",
      "lean_statement": "∀ (t : Tree) (k : Int), IsBst t → (k ∈ keys t ∨ (keys (bstInsert t k)).Perm (k :: keys t))",
      "nl_gloss": "If the input tree is a valid BST and the key was absent, the output's keys are the input's keys plus the new key.",
      "linked_semantic_units": ["SU3"],
      "importance": "critical",
      "proof_relevance": "direct"
    },
    {
      "id": "obl_003",
      "kind": "postcondition",
      "lean_statement": "∀ (t : Tree) (k : Int), IsBst t → k ∈ keys t → (keys (bstInsert t k)).Perm (keys t)",
      "nl_gloss": "If the input tree is a valid BST and the key was already present, the output's keys are a permutation of the input's.",
      "linked_semantic_units": ["SU4"],
      "importance": "supporting",
      "proof_relevance": "auxiliary"
    }
  ]
}
