{
  "schema_version": "schema_v1",
  "instance_id": "sorting_merge_sort_005",
  "benchmark_version": "v0.3",
  "obligations": [
    {
      "id": "obl_001",
      "kind": "postcondition",
      "lean_statement": "\u2200 (arr : Arr), (mergeSort arr).length = arr.length",
      "nl_gloss": "The output length equals the input length.",
      "linked_semantic_units": [
        "SU1"
      ],
      "importance": "critical",
      "proof_relevance": "direct"
    },
    {
      "id": "obl_002",
      "kind": "postcondition",
      "lean_statement": "\u2200 (arr : Arr), SortedLE (mergeSort arr)",
      "nl_gloss": "The output is sorted in nondecreasing order.",
      "linked_semantic_units": [
        "SU2"
      ],
      "importance": "critical",
      "proof_relevance": "direct"
    },
    {
      "id": "obl_003",
      "kind": "postcondition",
      "lean_statement": "\u2200 (arr : Arr), (mergeSort arr).Perm arr",
      "nl_gloss": "The output is a permutation of the input.",
      "linked_semantic_units": [
        "SU3"
      ],
      "importance": "critical",
      "proof_relevance": "direct"
    }
  ]
}
