{
  "schema_version": "schema_v1",
  "instance_id": "graph_bfs_shortest_path_003",
  "benchmark_version": "v0.3",
  "obligations": [
    {
      "id": "obl_001",
      "kind": "postcondition",
      "lean_statement": "\u2200 (adj : Adj) (src : Nat), (bfsShortestPath adj src).length = adj.length",
      "nl_gloss": "The output has the same length as the number of vertices.",
      "linked_semantic_units": [
        "SU1"
      ],
      "importance": "critical",
      "proof_relevance": "direct"
    },
    {
      "id": "obl_002",
      "kind": "postcondition",
      "lean_statement": "\u2200 (adj : Adj) (src : Nat), src < adj.length \u2192 (bfsShortestPath adj src).get? src = some (some 0)",
      "nl_gloss": "The distance from the source to itself is zero.",
      "linked_semantic_units": [
        "SU2"
      ],
      "importance": "critical",
      "proof_relevance": "direct"
    },
    {
      "id": "obl_003",
      "kind": "postcondition",
      "lean_statement": "\u2200 (adj : Adj) (src v k : Nat), (bfsShortestPath adj src).get? v = some (some k) \u2192 \u2203 path : List Nat, path.head? = some src \u2227 path.getLast? = some v \u2227 path.length = k + 1",
      "nl_gloss": "If dist[v] = Some(k), there is a path from source to v with exactly k edges.",
      "linked_semantic_units": [
        "SU3"
      ],
      "importance": "critical",
      "proof_relevance": "direct"
    },
    {
      "id": "obl_004",
      "kind": "postcondition",
      "lean_statement": "\u2200 (adj : Adj) (src v k : Nat), (bfsShortestPath adj src).get? v = some (some k) \u2192 \u2200 (path : List Nat), path.head? = some src \u2192 path.getLast? = some v \u2192 k + 1 \u2264 path.length",
      "nl_gloss": "If dist[v] = Some(k), no path from source to v has fewer than k edges.",
      "linked_semantic_units": [
        "SU4"
      ],
      "importance": "critical",
      "proof_relevance": "direct"
    },
    {
      "id": "obl_005",
      "kind": "postcondition",
      "lean_statement": "\u2200 (adj : Adj) (src v : Nat), (bfsShortestPath adj src).get? v = some none \u2194 \u00ac \u2203 (path : List Nat), path.head? = some src \u2227 path.getLast? = some v",
      "nl_gloss": "dist[v] = None if and only if no path from source to v exists.",
      "linked_semantic_units": [
        "SU5"
      ],
      "importance": "critical",
      "proof_relevance": "direct"
    }
  ]
}
