{
  "schema_version": "schema_v1",
  "instance_id": "greedy_interval_scheduling_002",
  "benchmark_version": "v0.3",
  "obligations": [
    {
      "id": "obl_001",
      "kind": "postcondition",
      "lean_statement": "∀ (ivs : Intervals), (∀ i ∈ ivs, i.start < i.stop) → ∃ (sel : List Nat), Feasible ivs sel ∧ sel.length = intervalScheduling ivs",
      "nl_gloss": "When every input interval has strictly positive length, there exists a feasible selection whose size equals the returned count.",
      "linked_semantic_units": ["SU1", "SU2"],
      "importance": "critical",
      "proof_relevance": "direct"
    },
    {
      "id": "obl_002",
      "kind": "postcondition",
      "lean_statement": "∀ (ivs : Intervals) (sel : List Nat), (∀ i ∈ ivs, i.start < i.stop) → Feasible ivs sel → sel.length ≤ intervalScheduling ivs",
      "nl_gloss": "When every input interval has strictly positive length, no feasible selection is strictly larger than the returned count.",
      "linked_semantic_units": ["SU3"],
      "importance": "critical",
      "proof_relevance": "direct"
    },
    {
      "id": "obl_003",
      "kind": "postcondition",
      "lean_statement": "∀ (a b : Interval), a.stop = b.start → NonOverlap a b",
      "nl_gloss": "Intervals touching at a single endpoint are non-overlapping.",
      "linked_semantic_units": ["SU4"],
      "importance": "supporting",
      "proof_relevance": "auxiliary"
    }
  ]
}
