{
  "schema_version": "schema_v1",
  "instance_id": "dp_longest_common_subsequence_001",
  "benchmark_version": "v0.3",
  "obligations": [
    {
      "id": "obl_001",
      "kind": "postcondition",
      "lean_statement": "∀ (a b : Arr), lcsLength a b ≤ a.length ∧ lcsLength a b ≤ b.length",
      "nl_gloss": "The result is bounded above by the lengths of both inputs.",
      "linked_semantic_units": ["SU1"],
      "importance": "supporting",
      "proof_relevance": "auxiliary"
    },
    {
      "id": "obl_002",
      "kind": "postcondition",
      "lean_statement": "∀ (a b : Arr), ∃ (ia ib : List Nat), CommonSubseq a b ia ib ∧ ia.length = lcsLength a b",
      "nl_gloss": "There exists a common subsequence of length equal to the returned value.",
      "linked_semantic_units": ["SU2", "SU4"],
      "importance": "critical",
      "proof_relevance": "direct"
    },
    {
      "id": "obl_003",
      "kind": "postcondition",
      "lean_statement": "∀ (a b : Arr) (ia ib : List Nat), CommonSubseq a b ia ib → ia.length ≤ lcsLength a b",
      "nl_gloss": "No common subsequence is strictly longer than the returned value.",
      "linked_semantic_units": ["SU3"],
      "importance": "critical",
      "proof_relevance": "direct"
    },
    {
      "id": "obl_004",
      "kind": "postcondition",
      "lean_statement": "∀ (a b : Arr), lcsLength a b = lcsLength b a",
      "nl_gloss": "LCS length is symmetric in its arguments.",
      "linked_semantic_units": ["SU5"],
      "importance": "supporting",
      "proof_relevance": "auxiliary"
    }
  ]
}
